{
  "schema_version": "1.0.0",
  "id": "EVD-WP-2026-0090-G07-composition",
  "work_package_id": "WP-2026-0090",
  "gate": "G07",
  "claim": "the composition claim of WP-2026-0090: the expected content tree bound to its target base (recomputed and compared by scripts/badf_compose.py on the composed tree)",
  "evidence_type": "composition",
  "producer": {
    "id": "badf-self-dossier",
    "type": "controller"
  },
  "source_revision": "HEAD",
  "target": "bstBizEra/badf:main",
  "toolchain": {
    "name": "badf_compose.py --record",
    "version": "1"
  },
  "operation": "badf_compose.py --record",
  "started_at": "2026-08-30T10:52:18Z",
  "completed_at": "2026-08-30T10:52:18Z",
  "outcome": "PASS",
  "artifact": "work/WP-2026-0090/evidence/G07/composition-record.json",
  "digest": "sha256:39e311f2e8c94d9b87028457716c96c0c79f5eb52054c6ff92c4536588ae73fa"
}
