{
  "schema_version": "1.0.0",
  "id": "EVD-WP-2026-0091-G07-unit-test",
  "work_package_id": "WP-2026-0091",
  "gate": "G07",
  "claim": "unit tests run in the composed-tree gate, not here",
  "evidence_type": "unit-test",
  "producer": {
    "id": "badf-self-dossier",
    "type": "controller"
  },
  "source_revision": "HEAD",
  "target": "bstBizEra/badf:main",
  "toolchain": {
    "name": "deferred-to-compose",
    "version": "1"
  },
  "operation": "deferred-to-compose",
  "started_at": "2026-08-30T11:29:44Z",
  "completed_at": "2026-08-30T11:29:44Z",
  "outcome": "NOT_RUN",
  "artifact": "work/WP-2026-0091/evidence/G07/unit-test.txt",
  "digest": "sha256:3ebfe5e512dfeda144788ffffd16868b94226c8875f266fe231350792fa89fbc"
}
