{
  "schema_version": "1.0.0",
  "id": "EVD-WP-2026-0055-G07-source-change",
  "work_package_id": "WP-2026-0055",
  "gate": "G07",
  "claim": "the change WP-2026-0055 makes to this repository, outside its own directory and the lockfile",
  "evidence_type": "source-change",
  "producer": {
    "id": "badf-self-dossier",
    "type": "controller"
  },
  "source_revision": "HEAD",
  "target": "bstBizEra/badf:main",
  "toolchain": {
    "name": "git diff",
    "version": "1"
  },
  "operation": "git diff",
  "started_at": "2026-08-28T21:51:30Z",
  "completed_at": "2026-08-28T21:51:30Z",
  "outcome": "PASS",
  "artifact": "work/WP-2026-0055/evidence/G07/source-change.diff",
  "digest": "sha256:1444a8edfaf5b945de0febf59ecd66a1174a7236d30a004d7e4d3f2dcc99fb9e"
}
