{
  "schema_version": "1.0.0",
  "id": "EVD-WP-2026-0056-G07-documentation",
  "work_package_id": "WP-2026-0056",
  "gate": "G07",
  "claim": "the documentation this change carries",
  "evidence_type": "documentation",
  "producer": {
    "id": "badf-self-dossier",
    "type": "controller"
  },
  "source_revision": "HEAD",
  "target": "bstBizEra/badf:main",
  "toolchain": {
    "name": "git diff",
    "version": "1"
  },
  "operation": "git diff",
  "started_at": "2026-08-29T05:51:22Z",
  "completed_at": "2026-08-29T05:51:22Z",
  "outcome": "PASS",
  "artifact": "work/WP-2026-0056/evidence/G07/documentation.diff",
  "digest": "sha256:8c1837308d8d987bc6b7f824d252cbd1fcc2e4eb857ab4e0c1b35e30b4918f27"
}
